{
  "depends_on": [],
  "dossier": "dossiers/models/concorda-api__models_event_relationship.py__EventRelationship.md",
  "external_consumers": [],
  "extractor": "extract_api.py",
  "feature": null,
  "id": "concorda-api::models/event_relationship.py::EventRelationship",
  "kind": "model",
  "schema_version": 1,
  "signature": {
    "kind": "model",
    "name": "EventRelationship",
    "tablename": "event_relationships"
  },
  "source": {
    "line": 6,
    "path": "models/event_relationship.py",
    "repo": "concorda-api",
    "symbol": "EventRelationship"
  },
  "structural_hash": "73cc571fc18c8a1164b737ad5cbbcd0c2bd1bfa31169cb46a48c780a5d23ece1",
  "tests": [],
  "title": "EventRelationship",
  "warnings": []
}
