{
  "schema_version": 1,
  "id": "concorda-web::src/components/ui/hero-banner.tsx::HeroBanner",
  "kind": "component",
  "title": "HeroBanner",
  "feature": null,
  "source": {
    "repo": "concorda-web",
    "path": "src/components/ui/hero-banner.tsx",
    "symbol": "HeroBanner",
    "line": 15
  },
  "signature": {
    "name": "HeroBanner",
    "kind": "component"
  },
  "structural_hash": "458f91a6a7c59697f7065480a04e4225c056aab138a5698e7778435f8d7f8aa0",
  "depends_on": [],
  "external_consumers": [],
  "tests": [],
  "dossier": "dossiers/components/concorda_web__src_components_ui_hero_banner_tsx__HeroBanner.md",
  "extractor": "extract_web.ts",
  "warnings": []
}
