{
  "schema_version": 1,
  "id": "concorda-test::lib/api-client.ts::ApiClient.register",
  "kind": "service",
  "title": "ApiClient.register",
  "feature": null,
  "source": {
    "repo": "concorda-test",
    "path": "lib/api-client.ts",
    "symbol": "ApiClient.register",
    "line": 114
  },
  "signature": {
    "name": "ApiClient.register",
    "kind": "service"
  },
  "structural_hash": "fcd178f9d5fbb0f0d3524713d7213c41759b6b4046357370116ec922ecc11d7f",
  "depends_on": [
    {
      "target": "POST::/api/auth/register",
      "via": "http_call",
      "where": "api-client.ts:130",
      "confidence": "exact"
    }
  ],
  "external_consumers": [],
  "tests": [],
  "dossier": "dossiers/services/concorda_test__lib_api_client_ts__ApiClient_register.md",
  "extractor": "extract_tests.ts",
  "warnings": []
}
