{
  "depends_on": [
    {
      "confidence": "exact",
      "target": "concorda-api::models/regatta.py::Regatta",
      "via": "db_query",
      "where": "routers/regattas.py:241"
    }
  ],
  "dossier": "dossiers/endpoints/DELETE___api_regattas_0.md",
  "external_consumers": [],
  "extractor": "extract_api.py",
  "feature": null,
  "id": "DELETE::/api/regattas/{0}",
  "kind": "endpoint",
  "schema_version": 1,
  "signature": {
    "auth": "none",
    "method": "DELETE",
    "path": "/api/regattas/{regatta_id}",
    "request_schema_ref": null,
    "response_schema_ref": null
  },
  "source": {
    "line": 235,
    "path": "routers/regattas.py",
    "repo": "concorda-api",
    "symbol": "delete_regatta"
  },
  "structural_hash": "f696796282bfd31a46bd8ca6c092926558ae73bada13ff19c0935fe0156ef68b",
  "tests": [],
  "title": "DELETE /api/regattas/{regatta_id}",
  "warnings": []
}
