{
  "depends_on": [],
  "dossier": "dossiers/services/concorda-api__utils_email_utils.py__send_support_request_email.md",
  "external_consumers": [],
  "extractor": "extract_api.py",
  "feature": null,
  "id": "concorda-api::utils/email_utils.py::send_support_request_email",
  "kind": "service",
  "schema_version": 1,
  "signature": {
    "args": [
      "sender_name",
      "sender_email",
      "sender_phone",
      "message",
      "db"
    ],
    "kind": "service",
    "name": "send_support_request_email"
  },
  "source": {
    "line": 1086,
    "path": "utils/email_utils.py",
    "repo": "concorda-api",
    "symbol": "send_support_request_email"
  },
  "structural_hash": "8a259071ac75775470a57e1a6eddc47105c5e8c6bcbd51dcc2fe7cbc0d31548b",
  "tests": [],
  "title": "send_support_request_email",
  "warnings": []
}
