{
  "schema_version": 1,
  "id": "concorda-web::src/components/back-button.tsx::BackButton",
  "kind": "component",
  "title": "BackButton",
  "feature": null,
  "source": {
    "repo": "concorda-web",
    "path": "src/components/back-button.tsx",
    "symbol": "BackButton",
    "line": 32
  },
  "signature": {
    "name": "BackButton",
    "kind": "component"
  },
  "structural_hash": "2daecb2697ad5f8b208800604e4f69bb3035eb15ea561668a8071f1bccb86e45",
  "depends_on": [
    {
      "target": "concorda-web::src/lib/utils.ts::cn",
      "via": "hook_call",
      "where": "back-button.tsx:59",
      "confidence": "exact"
    },
    {
      "target": "concorda-web::src/lib/utils.ts::cn",
      "via": "hook_call",
      "where": "back-button.tsx:70",
      "confidence": "exact"
    }
  ],
  "external_consumers": [],
  "tests": [],
  "dossier": "dossiers/components/concorda_web__src_components_back_button_tsx__BackButton.md",
  "extractor": "extract_web.ts",
  "warnings": []
}
