{
  "schema_version": 1,
  "id": "concorda-web::src/components/dashboard/events-calendar.tsx::getMonthLabel",
  "kind": "service",
  "title": "getMonthLabel",
  "feature": null,
  "source": {
    "repo": "concorda-web",
    "path": "src/components/dashboard/events-calendar.tsx",
    "symbol": "getMonthLabel",
    "line": 83
  },
  "signature": {
    "name": "getMonthLabel",
    "kind": "service"
  },
  "structural_hash": "5f59e64bd85ae86db212dd5efba4422774b5d590508177ec59fd582b08e51078",
  "depends_on": [],
  "external_consumers": [],
  "tests": [],
  "dossier": "dossiers/services/concorda_web__src_components_dashboard_events_calendar_tsx__getMonthLabel.md",
  "extractor": "extract_web.ts",
  "warnings": []
}
