{
  "depends_on": [
    {
      "confidence": "exact",
      "target": "concorda-api::utils/image_utils.py::save_upload",
      "via": "import",
      "where": "routers/profile.py:257"
    },
    {
      "confidence": "exact",
      "target": "concorda-api::utils/websocket_manager.py::broadcast_event",
      "via": "websocket",
      "where": "routers/profile.py:263"
    },
    {
      "confidence": "exact",
      "target": "concorda-api::schemas/profile.py::ProfileRead",
      "via": "import",
      "where": "routers/profile.py:245"
    },
    {
      "confidence": "exact",
      "target": "concorda-api::models/person.py::Person",
      "via": "db_query",
      "where": "routers/profile.py:253"
    }
  ],
  "dossier": "dossiers/endpoints/POST___api_profile_banner.md",
  "external_consumers": [],
  "extractor": "extract_api.py",
  "feature": null,
  "id": "POST::/api/profile/banner",
  "kind": "endpoint",
  "schema_version": 1,
  "signature": {
    "auth": "user",
    "method": "POST",
    "path": "/api/profile/banner",
    "request_schema_ref": "UploadFile",
    "response_schema_ref": "ProfileRead"
  },
  "source": {
    "line": 246,
    "path": "routers/profile.py",
    "repo": "concorda-api",
    "symbol": "upload_profile_banner"
  },
  "structural_hash": "6002adaf6eb675226b01b15cd2e71606b74263caca56afa0143ef5ea469878cf",
  "tests": [],
  "title": "POST /api/profile/banner",
  "warnings": []
}
