{
  "schema_version": 1,
  "id": "concorda-web::src/app/invite/[token]/page.tsx::InvitePageContent",
  "kind": "component",
  "title": "InvitePageContent",
  "feature": null,
  "source": {
    "repo": "concorda-web",
    "path": "src/app/invite/[token]/page.tsx",
    "symbol": "InvitePageContent",
    "line": 15
  },
  "signature": {
    "name": "InvitePageContent",
    "kind": "component"
  },
  "structural_hash": "414c85de1b06d1f45faef381de66c5fa968871fba9dd82c13310ab3150ec416a",
  "depends_on": [
    {
      "target": "concorda-web::src/contexts/auth-context.tsx::useAuth",
      "via": "hook_call",
      "where": "page.tsx:19",
      "confidence": "exact"
    },
    {
      "target": "concorda-web::src/hooks/use-constants.ts::useConstants",
      "via": "hook_call",
      "where": "page.tsx:20",
      "confidence": "exact"
    },
    {
      "target": "concorda-web::src/lib/api.ts::inviteApi.getInvite",
      "via": "hook_call",
      "where": "page.tsx:30",
      "confidence": "exact"
    },
    {
      "target": "concorda-web::src/lib/api.ts::inviteApi.acceptInvite",
      "via": "hook_call",
      "where": "page.tsx:45",
      "confidence": "exact"
    }
  ],
  "external_consumers": [],
  "tests": [],
  "dossier": "dossiers/components/concorda_web__src_app_invite__token__page_tsx__InvitePageContent.md",
  "extractor": "extract_web.ts",
  "warnings": []
}
