{
  "schema_version": 1,
  "id": "concorda-web::src/lib/api.ts::adminTemporalProductsApi.delete",
  "kind": "service",
  "title": "adminTemporalProductsApi.delete",
  "feature": null,
  "source": {
    "repo": "concorda-web",
    "path": "src/lib/api.ts",
    "symbol": "adminTemporalProductsApi.delete",
    "line": 2610
  },
  "signature": {
    "name": "adminTemporalProductsApi.delete",
    "kind": "service"
  },
  "structural_hash": "2c525deb6c23123198dbbc18eb4003588d4d6f932d5cb86169d704f32701af77",
  "depends_on": [
    {
      "target": "DELETE::/api/temporal-products/{0}",
      "via": "string_url",
      "where": "api.ts:2611",
      "confidence": "fuzzy"
    }
  ],
  "external_consumers": [],
  "tests": [],
  "dossier": "dossiers/services/concorda_web__src_lib_api_ts__adminTemporalProductsApi_delete.md",
  "extractor": "extract_web.ts",
  "warnings": []
}
