{
  "schema_version": 1,
  "id": "concorda-test::tests/boats/coowner-approval-vote.spec.ts::test@14",
  "kind": "test",
  "title": "owner sees pending approval and can accept it",
  "feature": null,
  "source": {
    "repo": "concorda-test",
    "path": "tests/boats/coowner-approval-vote.spec.ts",
    "symbol": "test@14",
    "line": 14
  },
  "signature": {
    "name": "test@14",
    "kind": "test"
  },
  "structural_hash": "c1e3167d62ce46c675c2c17a21916431a16fcdf0488dc80d4c1f1c77b071dbd4",
  "depends_on": [
    {
      "target": "concorda-test::lib/api-client.ts::ApiClient.login",
      "via": "hook_call",
      "where": "coowner-approval-vote.spec.ts:17",
      "confidence": "exact"
    },
    {
      "target": "concorda-test::lib/api-client.ts::ApiClient.login",
      "via": "hook_call",
      "where": "coowner-approval-vote.spec.ts:20",
      "confidence": "exact"
    },
    {
      "target": "concorda-test::lib/api-client.ts::ApiClient.getBoats",
      "via": "hook_call",
      "where": "coowner-approval-vote.spec.ts:21",
      "confidence": "exact"
    },
    {
      "target": "concorda-test::lib/api-client.ts::ApiClient.requestCoowner",
      "via": "hook_call",
      "where": "coowner-approval-vote.spec.ts:27",
      "confidence": "exact"
    },
    {
      "target": "concorda-test::lib/api-client.ts::ApiClient.listApprovalRequests",
      "via": "hook_call",
      "where": "coowner-approval-vote.spec.ts:46",
      "confidence": "exact"
    }
  ],
  "external_consumers": [],
  "tests": [],
  "dossier": "dossiers/tests/concorda_test__tests_boats_coowner_approval_vote_spec_ts__test_14.md",
  "extractor": "extract_tests.ts",
  "warnings": []
}
