{
  "depends_on": [
    {
      "confidence": "exact",
      "target": "concorda-api::models/person_product.py::PersonProduct",
      "via": "db_query",
      "where": "routers/profile.py:1387"
    },
    {
      "confidence": "exact",
      "target": "concorda-api::utils/websocket_manager.py::broadcast_event",
      "via": "websocket",
      "where": "routers/profile.py:1392"
    },
    {
      "confidence": "exact",
      "target": "concorda-api::schemas/profile.py::ProfileRead",
      "via": "import",
      "where": "routers/profile.py:1333"
    },
    {
      "confidence": "exact",
      "target": "concorda-api::models/person.py::Person",
      "via": "db_query",
      "where": "routers/profile.py:1340"
    },
    {
      "confidence": "exact",
      "target": "concorda-api::models/temporal_product.py::TemporalProduct",
      "via": "db_query",
      "where": "routers/profile.py:1344"
    },
    {
      "confidence": "exact",
      "target": "concorda-api::models/transaction.py::Transaction",
      "via": "db_query",
      "where": "routers/profile.py:1364"
    }
  ],
  "dossier": "dossiers/endpoints/POST___api_profile_membership_upgrade.md",
  "external_consumers": [],
  "extractor": "extract_api.py",
  "feature": null,
  "id": "POST::/api/profile/membership/upgrade",
  "kind": "endpoint",
  "schema_version": 1,
  "signature": {
    "auth": "user",
    "method": "POST",
    "path": "/api/profile/membership/upgrade",
    "request_schema_ref": "MembershipUpgradeRequest",
    "response_schema_ref": "ProfileRead"
  },
  "source": {
    "line": 1334,
    "path": "routers/profile.py",
    "repo": "concorda-api",
    "symbol": "upgrade_membership"
  },
  "structural_hash": "9a1a78e4c09e8e6f6ec22a4bb9e8bea28a91ac00fc39f6e6d2481aab9e5f3366",
  "tests": [],
  "title": "POST /api/profile/membership/upgrade",
  "warnings": []
}
