{
  "schema_version": 1,
  "id": "concorda-web::src/lib/api.ts::profileApi.uploadBoatBanner",
  "kind": "service",
  "title": "profileApi.uploadBoatBanner",
  "feature": null,
  "source": {
    "repo": "concorda-web",
    "path": "src/lib/api.ts",
    "symbol": "profileApi.uploadBoatBanner",
    "line": 1297
  },
  "signature": {
    "name": "profileApi.uploadBoatBanner",
    "kind": "service"
  },
  "structural_hash": "2a5499b329f0d3c70903731b9c57be606c9682481a3e276e2d9d80d7305d01bd",
  "depends_on": [],
  "external_consumers": [],
  "tests": [],
  "dossier": "dossiers/services/concorda_web__src_lib_api_ts__profileApi_uploadBoatBanner.md",
  "extractor": "extract_web.ts",
  "warnings": []
}
