{
  "schema_version": 1,
  "id": "concorda-web::src/components/ui/chart.tsx::useChart",
  "kind": "hook",
  "title": "useChart",
  "feature": null,
  "source": {
    "repo": "concorda-web",
    "path": "src/components/ui/chart.tsx",
    "symbol": "useChart",
    "line": 27
  },
  "signature": {
    "name": "useChart",
    "kind": "hook"
  },
  "structural_hash": "6433da73d6b0f5a8033fc293709f358d97b831edc0f928a8d1f37590748ecf9b",
  "depends_on": [],
  "external_consumers": [],
  "tests": [],
  "dossier": "dossiers/hooks/concorda_web__src_components_ui_chart_tsx__useChart.md",
  "extractor": "extract_web.ts",
  "warnings": []
}
